date,buy_price,sell_price,source,note
2024-12-31,82.20,84.20,"Bao Phap Luat TP.HCM (plo.vn)","Phien cuoi nam 2024"
2025-12-31,150.80,152.80,"webgia.com (nguon SJC, lan cap nhat cuoi ngay 31/12/2025)","Cap nhat 13:15"
2026-01-29,144.80,147.80,"Simplize (simplize.vn)","Sau khi giam 4tr mua / 3.5tr ban trong ngay the gioi lap dinh 5594.82 USD/oz"
2026-04-01,189.00,191.00,"Tong hop Finhay (190.3tr) va VietnamNet (192.2tr)","UOC LUONG - ngay dinh chinh xac KHONG thong nhat giua cac nguon, dat tam tai ranh gioi Q1/Q2 2026"
2026-05-18,161.30,163.80,"vangviet.net (bang du lieu 30 ngay)","Cap nhat MOI NHAT tren trang luc truy cap"
2026-06-19,148.80,151.30,"Vietnam.vn (vietnam.vn gia vang hom nay 19/6/2026)","On dinh quanh 151.3tr, the gioi lui ve 4248 USD/oz"
